{
  "$schema": "http://json-schema.org/draft-04/schema#",
  "title": "Create And Amend Other Employment Income Request",
  "description": "Create And Amend Other Employment Income Request",
  "type": "object",
  "properties": {
    "shareOption": {"$ref": "otherEmployment_definitions.json#/definitions/shareOption"},
    "sharesAwardedOrReceived": {"$ref": "otherEmployment_definitions.json#/definitions/sharesAwardedOrReceived"},
    "disability": {"$ref": "otherEmployment_definitions.json#/definitions/disability"},
    "foreignService": {"$ref": "otherEmployment_definitions.json#/definitions/foreignService"},
    "lumpSums": {"$ref": "otherEmployment_definitions.json#/definitions/lumpSums"}
  }
}